{
  "dsl_version": "0.1.0",
  "task_id": "post_move_demo_20260329140216",
  "task_name": "post_move_demo",
  "feature_name": "post_move_demo",
  "execution_mode": "api",
  "scenarios": [
    {
      "scenario_id": "scenario_001",
      "name": "用户登录后进入用户中心并看到昵称",
      "goal": "用户登录后进入用户中心并看到昵称",
      "priority": "P0",
      "preconditions": [
        "用户登录后进入用户中心并看到昵称"
      ],
      "source_chunks": [
        "chunk_001"
      ],
      "steps": [
        {
          "step_id": "scenario_001_step_01",
          "step_type": "given",
          "text": "用户登录后进入用户中心并看到昵称",
          "assertions": [],
          "uses_context": [],
          "saves_context": []
        },
        {
          "step_id": "scenario_001_step_02",
          "step_type": "when",
          "text": "用户登录后进入用户中心并看到昵称",
          "assertions": [],
          "uses_context": [],
          "saves_context": []
        },
        {
          "step_id": "scenario_001_step_03",
          "step_type": "then",
          "text": "用户登录后进入用户中心并看到昵称",
          "assertions": [
            "用户登录后进入用户中心并看到昵称"
          ],
          "uses_context": [],
          "saves_context": []
        }
      ]
    }
  ],
  "metadata": {
    "source_type": "text",
    "language": "zh-CN"
  }
}