{
  "dsl_version": "0.2.0",
  "task_id": "manual_smoke_20260404165613",
  "task_name": "manual_smoke",
  "feature_name": "manual_smoke",
  "execution_mode": "api",
  "scenarios": [
    {
      "scenario_id": "scenario_001",
      "name": "执行核心业务动作",
      "goal": "????",
      "priority": "P2",
      "preconditions": [
        "从有效的 API 入口开始执行"
      ],
      "source_chunks": [
        "chunk_001",
        "contract_envelope_errors",
        "contract_preflight",
        "contract_execute",
        "contract_task_list"
      ],
      "steps": [
        {
          "step_id": "scenario_001_step_01",
          "step_type": "given",
          "text": "从有效的 API 入口开始执行",
          "request": {},
          "load_profile": {},
          "assertions": [],
          "uses_context": [],
          "saves_context": [],
          "save_context": {},
          "assertion_quality": {
            "llm_attempted": false,
            "fallback_reason": "",
            "invalid_assertion_count": 0,
            "generated_by_counts": {
              "rules": 0,
              "llm": 0,
              "llm_repair": 0,
              "manual": 0
            },
            "high_confidence_count": 0,
            "weak_assertion": true,
            "warning": "non_request_step"
          }
        },
        {
          "step_id": "scenario_001_step_02",
          "step_type": "when",
          "text": "执行核心业务动作",
          "request": {
            "method": "POST",
            "url": "/resource",
            "json": {
              "input": "执行核心业务动作"
            }
          },
          "load_profile": {},
          "assertions": [
            {
              "assertion_id": "assertion_01",
              "source": "status_code",
              "op": "eq",
              "severity": "critical",
              "category": "status",
              "confidence": 0.98,
              "generated_by": "rules",
              "reasoning": "request_status_template",
              "fallback_used": false,
              "expected": 200
            }
          ],
          "uses_context": [],
          "saves_context": [],
          "save_context": {},
          "assertion_quality": {
            "llm_attempted": false,
            "fallback_reason": "",
            "invalid_assertion_count": 0,
            "generated_by_counts": {
              "rules": 1,
              "llm": 0,
              "llm_repair": 0,
              "manual": 0
            },
            "high_confidence_count": 1,
            "weak_assertion": true,
            "warning": "weak_assertion_set"
          }
        },
        {
          "step_id": "scenario_001_step_03",
          "step_type": "then",
          "text": "系统返回符合需求的可观察结果",
          "request": {},
          "load_profile": {},
          "assertions": [
            "系统返回符合需求的可观察结果"
          ],
          "uses_context": [],
          "saves_context": [],
          "save_context": {},
          "assertion_quality": {
            "llm_attempted": false,
            "fallback_reason": "",
            "invalid_assertion_count": 0,
            "generated_by_counts": {
              "rules": 0,
              "llm": 0,
              "llm_repair": 0,
              "manual": 1
            },
            "high_confidence_count": 0,
            "weak_assertion": true,
            "warning": "non_request_step"
          }
        }
      ]
    }
  ],
  "metadata": {
    "source_type": "text",
    "language": "zh-CN",
    "case_generation": {
      "api_scenario_count": 1,
      "scenario_count": 1,
      "parsed_entities": [
        "平台",
        "http",
        "api",
        "错误宜使用统一",
        "envelope",
        "code",
        "message",
        "details",
        "前端与自动化应优先解析该结构而非裸文本",
        "post"
      ]
    }
  }
}