{
  "dsl_version": "0.2.0",
  "task_id": "端到端测试5_20260403112819",
  "task_name": "端到端测试5",
  "feature_name": "端到端测试5",
  "execution_mode": "api",
  "scenarios": [
    {
      "scenario_id": "scenario_001",
      "name": "`POST /api/tasks`",
      "goal": "Platform 主链路联调需求说明（企业版草案）",
      "priority": "P2",
      "preconditions": [
        "当前平台已进入联调阶段，研发、测试与前端需要基于统一口径确认以下事项："
      ],
      "source_chunks": [
        "chunk_006",
        "chunk_008",
        "chunk_004",
        "contract_preflight",
        "contract_execute"
      ],
      "steps": [
        {
          "step_id": "scenario_001_step_01",
          "step_type": "given",
          "text": "当前平台已进入联调阶段，研发、测试与前端需要基于统一口径确认以下事项：",
          "request": {},
          "load_profile": {},
          "assertions": [],
          "uses_context": [],
          "saves_context": [],
          "save_context": {}
        },
        {
          "step_id": "scenario_001_step_02",
          "step_type": "when",
          "text": "`POST /api/tasks`",
          "request": {
            "method": "POST",
            "url": "/api/tasks",
            "json": {
              "task_name": "demo_task_name",
              "source_type": "text",
              "requirement_text": "demo requirement text",
              "target_system": "http://127.0.0.1:8001",
              "environment": "test"
            }
          },
          "load_profile": {},
          "assertions": [
            {
              "source": "status_code",
              "op": "eq",
              "expected": 201
            },
            {
              "source": "json.data.task_id",
              "op": "exists"
            }
          ],
          "uses_context": [],
          "saves_context": [
            "resource_id",
            "task_id"
          ],
          "save_context": {
            "task_id": "json.data.task_id",
            "resource_id": "json.data.task_id"
          }
        },
        {
          "step_id": "scenario_001_step_03",
          "step_type": "then",
          "text": "平台主流程在同一任务生命周期内闭环完成",
          "request": {},
          "load_profile": {},
          "assertions": [
            "平台主流程在同一任务生命周期内闭环完成"
          ],
          "uses_context": [],
          "saves_context": [],
          "save_context": {}
        }
      ]
    },
    {
      "scenario_id": "scenario_002",
      "name": "`GET /api/tasks/{task_id}`",
      "goal": "Platform 主链路联调需求说明（企业版草案）",
      "priority": "P2",
      "preconditions": [
        "当前平台已进入联调阶段，研发、测试与前端需要基于统一口径确认以下事项："
      ],
      "source_chunks": [
        "chunk_006",
        "chunk_008",
        "chunk_004",
        "contract_preflight",
        "contract_execute"
      ],
      "steps": [
        {
          "step_id": "scenario_002_step_01",
          "step_type": "given",
          "text": "当前平台已进入联调阶段，研发、测试与前端需要基于统一口径确认以下事项：",
          "request": {},
          "load_profile": {},
          "assertions": [],
          "uses_context": [],
          "saves_context": [],
          "save_context": {}
        },
        {
          "step_id": "scenario_002_step_02",
          "step_type": "when",
          "text": "`GET /api/tasks/{task_id}`",
          "request": {
            "method": "GET",
            "url": "/api/tasks/{{task_id}}"
          },
          "load_profile": {},
          "assertions": [
            {
              "source": "status_code",
              "op": "eq",
              "expected": 200
            }
          ],
          "uses_context": [],
          "saves_context": [],
          "save_context": {}
        },
        {
          "step_id": "scenario_002_step_03",
          "step_type": "then",
          "text": "关键中间产物可追踪、可复核、可回放",
          "request": {},
          "load_profile": {},
          "assertions": [
            "关键中间产物可追踪、可复核、可回放"
          ],
          "uses_context": [],
          "saves_context": [],
          "save_context": {}
        }
      ]
    }
  ],
  "metadata": {
    "source_type": "text",
    "language": "zh-CN",
    "case_generation": {
      "api_scenario_count": 2,
      "scenario_count": 2,
      "parsed_entities": [
        "platform",
        "主链路联调需求说明",
        "企业版草案",
        "背景与目的",
        "当前平台已进入联调阶段"
      ]
    }
  }
}